{
  "changeVersion": "0.1",
  "id": "change.move-north-window",
  "description": "Move the north living-room window 500 mm west, carrying its framed opening and preserving the kitchen outlets.",
  "baseRevision": 9,
  "preconditions": [
    {
      "path": "/elements/opening.window.north/placement/station",
      "equals": 7200
    }
  ],
  "operations": [
    {
      "op": "moveOpening",
      "openingId": "opening.window.north",
      "station": 6700
    }
  ]
}
